{"type":"config","name":"Optimize make agent-ci routing overhead","metricName":"agent_ci_ms","metricUnit":"ms","bestDirection":"lower"}
{"run":1,"commit":"2c15b8a","metric":100008,"metrics":{"classifier_ms":75,"surface_target_code":2,"stdout_bytes":2026,"status_code":0},"status":"keep","description":"Baseline for make agent-ci on a stable tiny scripts/ diff; end-to-end time is dominated by the routed ci-fast gate, while classifier-only cost is small but measurable.","timestamp":1778686901008,"segment":0,"confidence":null,"asi":{"hypothesis":"Establish a stable benchmark before optimizing routing overhead.","workload":"make agent-ci with a persistent tracked probe line in scripts/agent-ci-surface.sh causing ci-fast routing","baseline_observation":"Classifier overhead (~75ms) is tiny relative to full ci-fast runtime (~100s). Pure classifier optimization may not materially improve the primary metric unless routing target or gate startup cost also changes.","rollback_reason":"","next_action_hint":"Look for ways to reduce ci-fast startup/work under this surface without changing routing semantics, or retarget to a more routing-dominated workload if the goal is strictly classifier speed."}}
{"run":2,"commit":"2c15b8a","metric":97892,"metrics":{"classifier_ms":69,"surface_target_code":2,"stdout_bytes":413526,"status_code":0},"status":"discard","description":"Tried adding a script-surface-specific ci-fast branch, but it broke the documented outside-git release-gate fallback and the benchmark harness was masking command failures.","timestamp":1778687288879,"segment":0,"confidence":null,"asi":{"hypothesis":"A narrow contract-only verification path for CI-router shell scripts could cut ci-fast time without weakening safety.","rollback_reason":"The new ci-fast shell branch used git path discovery inside non-git fallback flows, causing agent-ci contract failure outside git; autoresearch harness also mis-recorded nonzero exit codes due to `if ! cmd` misuse.","next_action_hint":"Revert the ci-fast branch, fix the harness failure capture, then explore optimizations that preserve non-git fallback behavior or benchmark a narrower command directly.","broken_contract":"release_integration_contract_test::pre_public_check_contracts_early::source_snapshot_safety::runtime_artifacts::agent_ci_succeeds_outside_git_via_source_snapshot_safety_mode","lesson":"Any agent-ci optimization must preserve the source-snapshot/no-git fallback path documented in ci-strategy and tested by release integration contracts."}}
{"run":3,"commit":"6352cbb","metric":62186,"metrics":{"classifier_ms":80,"surface_target_code":2,"stdout_bytes":1942,"status_code":0},"status":"keep","description":"Control rerun after fixing autoresearch harness failure capture; warm-cache ci-fast runtime is far lower than the original baseline, showing large session noise.","timestamp":1778687360934,"segment":0,"confidence":17.87429111531191,"asi":{"hypothesis":"Measure benchmark noise after fixing status capture in autoresearch.sh.","workload":"Unchanged repository logic; only benchmark harness failure capture fixed","baseline_observation":"Warm-cache agent-ci runs can vary by tens of seconds while classifier time stays ~70-80ms, so confidence on small optimization wins will require repeated controls.","rollback_reason":"","next_action_hint":"Run at least one more unchanged control to estimate the noise floor before trusting any marginal improvement in agent_ci_ms."}}
{"run":4,"commit":"6352cbb","metric":100699,"metrics":{"classifier_ms":83,"surface_target_code":2,"stdout_bytes":2026,"status_code":0},"status":"discard","description":"Repeated unchanged control run to measure noise; agent-ci swung back to ~101s, confirming the workload is too noisy for trusting single-run wins.","timestamp":1778687476684,"segment":0,"confidence":26.94834342714642,"asi":{"hypothesis":"Estimate the noise floor of the unchanged agent-ci workload.","rollback_reason":"No code change; control run was worse than baseline and confirms large variance dominated by test/lint execution.","next_action_hint":"Either redesign autoresearch.sh to benchmark a lower-noise subcommand such as the classifier itself, or report that end-to-end make agent-ci is dominated by noisy validation phases unsuitable for fine-grained optimization without repeated medians.","noise_observation":"Observed unchanged controls at ~62s and ~101s with classifier steady near ~80ms."}}
{"type":"config","name":"Optimize agent-ci classifier overhead","metricName":"classifier_ms","metricUnit":"ms","bestDirection":"lower"}
{"run":5,"commit":"1260360","metric":81,"metrics":{"agent_ci_ms":64272,"surface_target_code":2,"stdout_bytes":1942,"status_code":0},"status":"keep","description":"Retargeted the experiment to the real classifier overhead and updated the harness to use a 9-sample median for scripts/agent-ci-surface.sh --target on the stable tiny-diff workload.","timestamp":1778687587335,"segment":1,"confidence":null,"asi":{"hypothesis":"A lower-noise classifier-only metric is the right optimization target for this session; end-to-end agent-ci remains a secondary guardrail only.","workload":"Median of 9 classifier runs plus one guardrail make agent-ci run on the stable scripts/ diff workload","benchmark_fix":"Re-initialized autoresearch to use classifier_ms as the primary metric and documented why the prior end-to-end metric was too noisy.","rollback_reason":"","next_action_hint":"Now optimize scripts/agent-ci-surface.sh and release_policy helper usage directly, validating against the stable classifier metric while watching end-to-end agent_ci_ms for pathological regressions."}}
{"run":6,"commit":"1260360","metric":0,"metrics":{"agent_ci_ms":0,"surface_target_code":0,"stdout_bytes":0,"status_code":2},"status":"checks_failed","description":"Tried replacing changed-path collection with one git status porcelain parse, but the new parser broke macOS/app routing contracts and failed agent-ci validation.","timestamp":1778687727841,"segment":1,"confidence":null,"asi":{"hypothesis":"One git status --porcelain=v1 -z call plus local parsing could replace three Git subprocesses and cut classifier_ms.","rollback_reason":"The parser changed routing semantics: app and mk/macos surfaces incorrectly downgraded to ci-fast, so the change is not acceptable even if faster.","next_action_hint":"Keep the existing multi-command collection for correctness, or prototype a parser only with stronger fixture coverage before rerunning.","broken_tests":"agent_ci_surface_contract_test::{classifier_routes_apps_cueloopmac_working_tree_to_macos_ci,classifier_routes_macos_make_fragment_to_macos_ci}","lesson":"Classifier micro-optimizations must preserve all path-shape semantics exactly; contract tests catch subtle parse drift quickly."}}
{"run":7,"commit":"f447771","metric":80,"metrics":{"agent_ci_ms":65240,"surface_target_code":2,"stdout_bytes":1942,"status_code":0},"status":"keep","description":"Replaced repeated target-rank shell comparisons with direct case-based monotonic candidate promotion in scripts/agent-ci-surface.sh, yielding a tiny classifier median improvement.","timestamp":1778687828332,"segment":1,"confidence":null,"asi":{"hypothesis":"Eliminating target_rank helper calls and command substitutions in the hot candidate-promotion path can shave a small amount of classifier overhead without changing semantics.","practical_significance":"Very small improvement (81ms -> 80ms); likely near noise floor, but correctness checks passed and code is simpler in the hot path.","rollback_reason":"","next_action_hint":"Look next at changed_paths collection and Makefile diff special-case helpers for larger wins, but preserve contract coverage and no-git behavior."}}
{"run":8,"commit":"a21dfc3","metric":78,"metrics":{"agent_ci_ms":106904,"surface_target_code":2,"stdout_bytes":2026,"status_code":0},"status":"keep","description":"Inlined the docs-only path case match in scripts/agent-ci-surface.sh instead of calling public_is_docs_only_path for each changed path, improving classifier median time.","timestamp":1778687973236,"segment":1,"confidence":3,"asi":{"hypothesis":"Removing per-path shell function dispatch in the docs-only scan can reduce classifier overhead while preserving the exact docs-only policy.","practical_significance":"Small but clearer win than the previous iteration (80ms -> 78ms) with unchanged routing semantics and passing checks.","rollback_reason":"","next_action_hint":"Next likely wins are other per-path helper calls in classify_special_path or reducing repeated Makefile diff helper work without changing policy."}}
{"run":9,"commit":"cf326ac","metric":71,"metrics":{"agent_ci_ms":98999,"surface_target_code":2,"stdout_bytes":2026,"status_code":0},"status":"keep","description":"Inlined script-path release/macOS routing matches directly in scripts/agent-ci-surface.sh instead of calling release_policy helper functions for each scripts/* path, materially reducing classifier median time.","timestamp":1778688117295,"segment":1,"confidence":6.666666666666667,"asi":{"hypothesis":"Inlining stable exact-match script routing policy locally can remove cross-file shell function dispatch overhead in classify_special_path without changing semantics.","practical_significance":"This is the clearest improvement so far (78ms -> 71ms) while preserving routing behavior and passing checks.","rollback_reason":"","next_action_hint":"Next likely win is reducing repeated helper dispatch for non-script path checks or caching Makefile diff text once when Makefile is in changed_paths."}}
{"run":10,"commit":"cf326ac","metric":83,"metrics":{"agent_ci_ms":100571,"surface_target_code":2,"stdout_bytes":2026,"status_code":0},"status":"discard","description":"Tried caching Makefile diff text once for Makefile-specific routing checks, but the added pre-check overhead regressed the classifier on the current small scripts/ workload.","timestamp":1778688261066,"segment":1,"confidence":5,"asi":{"hypothesis":"Computing Makefile diff lines once and reusing them would reduce repeated work when Makefile is in the changed set.","rollback_reason":"On the benchmark workload Makefile is not changed, so the unconditional membership check added overhead without offsetting savings.","next_action_hint":"Prefer optimizations that help the dominant scripts/ workload directly, or only add Makefile caching when the script is already inside a Makefile-specific branch.","lesson":"Pre-optimization guards can cost more than the saved work when the guarded path is rare in the benchmarked workload."}}
{"run":11,"commit":"cf326ac","metric":80,"metrics":{"agent_ci_ms":61900,"surface_target_code":2,"stdout_bytes":1942,"status_code":0},"status":"discard","description":"Tried moving scripts/* special-path routing ahead of Makefile handling in classify_special_path, but it regressed classifier median time on the benchmark workload.","timestamp":1778688374351,"segment":1,"confidence":6.666666666666667,"asi":{"hypothesis":"Putting the dominant scripts/* workload first in classify_special_path would reduce branch work for the active benchmark case.","rollback_reason":"The reordering did not improve the classifier and likely just shifted branch/layout costs without reducing meaningful work.","next_action_hint":"Focus next on helper calls that still occur per path in the main classification loop, especially non-script path helper dispatch, instead of pure branch reordering.","lesson":"Branch reordering alone is not a reliable win when the remaining work is dominated by helper calls and external command cost."}}
{"run":12,"commit":"cf326ac","metric":77,"metrics":{"agent_ci_ms":66022,"surface_target_code":2,"stdout_bytes":1942,"status_code":0},"status":"discard","description":"Inlined non-script path routing case matches in the main classification loop, but the result still regressed versus the current best classifier implementation.","timestamp":1778688476114,"segment":1,"confidence":5,"asi":{"hypothesis":"Inlining simple non-script path prefix matches from release_policy.sh would reduce helper dispatch in the main loop and improve classifier time.","rollback_reason":"Although it beat the original session baseline, it was worse than the current best kept state (71ms), so it does not justify replacing the existing implementation.","next_action_hint":"Keep the current best script-focused optimizations and look for remaining wins in changed_paths collection or Makefile-special handling that help the benchmarked scripts/* workload directly.","lesson":"Not every helper-inline translates into a win once the hottest path has already been simplified; measure against the current best, not just the original baseline."}}
{"run":13,"commit":"cf326ac","metric":77,"metrics":{"agent_ci_ms":61564,"surface_target_code":2,"stdout_bytes":1942,"status_code":0},"status":"discard","description":"Added an exact fast path for the common CI-router script files before the broader scripts/* patterns, but it still underperformed the current best classifier implementation.","timestamp":1778688573637,"segment":1,"confidence":5,"asi":{"hypothesis":"An exact fast path for the benchmarked CI-router script files would reduce pattern checks in classify_special_path and lower classifier time.","rollback_reason":"The added exact-match branch did not beat the current best result, so the extra special cases are not justified.","next_action_hint":"Avoid adding benchmark-specific special cases unless they produce a clear win; the remaining meaningful work is likely still in changed_paths collection and git diff helpers.","lesson":"Micro-specialization for the benchmark path can add complexity without improving the already-optimized common script routing path."}}
{"run":14,"commit":"cf326ac","metric":0,"metrics":{"agent_ci_ms":245,"surface_target_code":0,"stdout_bytes":186,"status_code":0},"status":"checks_failed","description":"Tried replacing the changed_paths sed/sort shell pipeline with a Python dedupe/sort pass, but the heredoc implementation consumed stdin and invalidated routing to noop.","timestamp":1778688612878,"segment":1,"confidence":5,"asi":{"hypothesis":"A single Python dedupe/sort pass could replace sed plus sort -u and reduce changed_paths collection overhead without changing semantics.","rollback_reason":"The implementation used `python3 - <<'PY'` in a pipeline, so Python read the script from stdin instead of the piped path list; changed_paths became empty and the benchmark workload collapsed to noop.","next_action_hint":"If revisiting Python-based changed_paths processing, pass code with `-c` or via a temp file so stdin remains available for path data.","broken_tests":"agent_ci_surface_contract_test (17 failures); benchmark surface_target_code fell from 2 to 0, so the measured classifier_ms was not comparable.","lesson":"Do not use heredoc-fed Python in a pipeline when the program must also consume stdin data; it silently invalidates the benchmark and routing semantics."}}
{"run":15,"commit":"cf326ac","metric":72,"metrics":{"agent_ci_ms":67660,"surface_target_code":2,"stdout_bytes":1942,"status_code":0},"status":"discard","description":"Re-tried changed_paths Python dedupe/sort using python3 -c so stdin stayed intact; it preserved semantics and checks passed, but still did not beat the current best classifier implementation.","timestamp":1778688713162,"segment":1,"confidence":5,"asi":{"hypothesis":"A Python dedupe/sort pass could replace sed plus sort -u with fewer shell processes and lower changed_paths overhead.","rollback_reason":"The corrected implementation preserved the workload and semantics, but its classifier time (72ms) remained slightly worse than the current best kept state (71ms).","next_action_hint":"Keep cf326ac as the best state; future wins likely require deeper changes to changed_paths collection or Makefile diff helpers, not more shell-to-Python swaps.","lesson":"A concept can be valid after a broken first attempt and still not be a net improvement; rerun cleanly, then compare against the current best rather than the original baseline."}}
{"run":16,"commit":"cf326ac","metric":78,"metrics":{"agent_ci_ms":62057,"surface_target_code":2,"stdout_bytes":1942,"status_code":0},"status":"discard","description":"Added an early scripts/* short-circuit in the docs-only scan, but it did not improve the classifier versus the current best implementation.","timestamp":1778688809342,"segment":1,"confidence":5,"asi":{"hypothesis":"A cheap scripts/* short-circuit in the docs-only phase would help the benchmark workload fail docs-only detection earlier and reduce total classifier work.","rollback_reason":"The optimization did not beat the current best result, so the extra special-case branch is not justified.","next_action_hint":"The remaining meaningful cost is likely outside the docs-only scan; focus on changed_paths collection or git diff helper cost rather than additional early exits here.","lesson":"Even semantically safe early exits are not worth keeping unless they produce a measurable win over the current best state."}}
{"run":17,"commit":"cf326ac","metric":77,"metrics":{"agent_ci_ms":71446,"surface_target_code":2,"stdout_bytes":1942,"status_code":0},"status":"discard","description":"Specialized Makefile diff collection inside the two Makefile helpers and removed the generic per-path diff helpers, but it still regressed versus the current best classifier implementation.","timestamp":1778688920944,"segment":1,"confidence":5,"asi":{"hypothesis":"Removing the generic diff-helper layer and scoping git diff collection directly to the Makefile-only helpers would reduce startup overhead on the hot scripts workload.","rollback_reason":"The specialized form did not outperform the current best kept implementation, so the refactor adds churn without measurable benefit.","next_action_hint":"Keep cf326ac as the best state; remaining wins likely require a different approach to changed_paths collection or fewer git subprocesses overall, not more shell refactoring around rare Makefile logic.","lesson":"Refactoring rare-path helper structure does not necessarily help a scripts-focused workload when the underlying git subprocess count is unchanged."}}
{"run":18,"commit":"cf326ac","metric":89,"metrics":{"agent_ci_ms":89569,"surface_target_code":2,"stdout_bytes":1942,"status_code":0},"status":"discard","description":"Tried replacing separate staged+unstaged diff enumeration with a single git diff --name-only HEAD plus untracked files, but the classifier got slower on the benchmark workload.","timestamp":1778689049220,"segment":1,"confidence":5,"asi":{"hypothesis":"One git diff --name-only HEAD plus ls-files --others could replace two diff subprocesses while preserving the changed-path set for routing.","rollback_reason":"Although the path set matched for the current repo state, the combined diff command was slower in practice than the original staged+unstaged pair on this workload.","next_action_hint":"Keep cf326ac as the best state; future wins likely require reducing shell/process overhead in a different way or accepting that the remaining cost is dominated by git itself.","lesson":"Fewer subprocesses do not guarantee lower latency when the replacement command does more work internally."}}
{"run":19,"commit":"cf326ac","metric":74,"metrics":{"agent_ci_ms":62668,"surface_target_code":2,"stdout_bytes":1942,"status_code":0},"status":"discard","description":"Inlined classify_special_path into the main classification loop to remove one shell function call per path, but it still did not beat the current best classifier implementation.","timestamp":1778689161489,"segment":1,"confidence":5,"asi":{"hypothesis":"Removing the classify_special_path function call from the per-path loop would reduce shell dispatch overhead and improve classifier time.","rollback_reason":"Although this was directionally better than several recent attempts, it remained slower than the current best kept implementation (71ms), so the extra duplication is not justified.","next_action_hint":"Keep cf326ac as the best state; further wins likely require lower-level changes to git/path collection cost rather than more shell control-flow inlining.","lesson":"Function-call elimination helps only to a point; once the hot path is already simplified, further inlining can add duplication without delivering the top result."}}
{"run":20,"commit":"3db0e01","metric":76,"metrics":{"agent_ci_ms":59741,"surface_target_code":2,"stdout_bytes":1942,"status_code":0},"status":"keep","description":"Broadened the stable benchmark workload from one CI-router script to two CI-router scripts to reduce overfitting risk while staying on the same ci-fast routed surface.","timestamp":1778689264547,"segment":1,"confidence":4,"asi":{"hypothesis":"A slightly broader but still script-only stable diff better represents the CI-router surface and reduces benchmark overfitting to one exact file path.","workload_change":"autoresearch.sh now inserts the probe marker into both scripts/agent-ci-surface.sh and scripts/pre-public-check.sh before measuring classifier_ms.","comparability_note":"This run resets the practical comparison baseline for future iterations because the benchmark workload changed shape, even though the routed surface stayed ci-fast.","rollback_reason":"","next_action_hint":"Future optimization runs should compare against this two-script workload and only keep changes that beat this recalibrated benchmark without changing routing semantics."}}
