{"run":21,"commit":"3db0e01","metric":77,"metrics":{"agent_ci_ms":99574,"surface_target_code":2,"stdout_bytes":2026,"status_code":0},"status":"discard","description":"Re-tested an explicit fast path for the common CI-router script files against the broader two-script workload, but it still underperformed the recalibrated benchmark.","timestamp":1778689406525,"segment":1,"confidence":3.3333333333333335,"asi":{"hypothesis":"With two CI-router scripts in the workload instead of one, an exact early ci-fast branch for those scripts might now pay for itself.","rollback_reason":"The exact-match fast path still failed to beat the recalibrated two-script benchmark, so the extra benchmark-shaped branching remains unjustified.","next_action_hint":"Future wins should come from more general reductions in changed_paths or git helper cost rather than adding path-specific branches for the benchmarked files.","lesson":"Broadening the workload reduced overfitting risk but did not make benchmark-specific exact branches worthwhile."}}
